Author,Datetime,Title,Content
sunaina1983,2019-06-06T13:18+00:00,Request ❤❤,Harmones Harmones Plzz Settle down Soon. We want to start life again with full Bloom 😍😍
nancy0925,2019-06-02T20:40+00:00,Skin Like A Reptile,"Ladies, Last period was 15 months ago. I feel great except that I am developing these purplish rough sandpaper like patches on my torso. My dermatologist told me as we age our skin thins. She recommended a cream but its not helping. I feel like I'm turning into a reptile! Is anyone else dealing with skin changes and if so what helped! Thanks!"
Guest,2019-06-05T10:11+00:00,Celiac disease and perimenopause....get tested!,"hello ladies i just wanted to warn all of you ladies out there who are struggling with the symptoms of perimenopause and memopause, please get tested for celiac disease or sensitivity! I am waiting on my results now and when i did research on gluten issues i was blown away by the symptoms. It mirrors alot of the perimenopausal symptoms drs think we are making up and it can cause early menopause. Most people probably wont have the disease or gluten sensitivity but it doesnt hurt to get tested to see. Your life and mental well being may be saved in the process."
Gypsy014,2019-06-01T15:37+00:00,Vestibular Migraines,"Hello ladies as many of you know the off balance dizzy feelings during peri and menopause are actually vestibular migraines aka MAV (very common) during menopause.. For all the ladies who only suffer from the off balance dizziness thank your lucky stars that you don't have the full on migraine attacks with it, as you can have these migraines silent or not, imagine having the dizziness off balance along with the full on migraine attack, it literally leaves you disabled can't do anything stops you in your tracks!! Just wanted to hear from the ladies who suffer both and if you have the full migraine attacks do you get the numbness on one side of your body , and also ive been getting the ocular migraine attack with my migraines they alternate, and leaves the one eye very blood shot red in only the one eye. Do any of you get this as well.. Hopefully everyone is feeling good today!!"
christine-Perim,2019-06-04T21:27+00:00,Chin up,hang in there!!! we are all in this hell together♥
crystals51917,2019-06-04T09:51+00:00,Sumatriptan Succinate Tablets for Head,"Went to the doctor AGAIN yesterday and I was prescribed Sumatriptan Succinate Tablets 25mg for the constant head pressure/headache / brain fog. I understand they are used for migraines but my doctor said they should help with the release of pressure. Does anybody use this medicine? She also recommended that i put peppermint on my temples... That did seem to work a little. Also, for the nausea and loss of appetite I sucked on some Gin-Gin, hard ginger candy found at Whole Food Stores and I finally ate something yesterday because early that morning I had no appetite and felt horrible. My dr says I have severe anxiety and thats my biggest issue. UGH! We know our bodies!! Lets see how these things work. Something has got to ease all this craziness!!!"
Eliaimee1970,2019-05-26T17:44+00:00,Pain in my tooth 7 days before period,hello Im trying to like keep track of this perimenopause and this morning out of the blue this upper molar start hurting and the endo work on the tooth in december and check in the tooth multiples time no sign of infection and my period is due in 7 days and on top of it i cant take any motrin and my hiatal hernia flare and i havent eaten real food in almost a month. im here crying and depressed .
joann1972,2019-06-04T17:50+00:00,Stomach Issues,"Hi Ladies... I too am struggling with digestion issues. I have had abdominal pain and lots of gurgling sounds, wind and a complete fullness in the upper abdominal area for going on two weeks now with little or no relief. I have had this in the past for short periods of time but this is the longest. I may also mention I just had my cycle after 40+ days and this started about a week before. This period is very light and almost non existent (just enough to aggravate you lol). Anyone else had it last this long. I have tried Apple cider vinegar, gas x, ranitidine just to name a few with little relief. The pain is gone but the bloat and fullness (almost causes breathlessness) is still holding on. Any encouragement would be greatly appreciated.. This peri is no joke."
rhonda64529,2019-06-04T02:37+00:00,Strong Emotions,"and i mean strong. does anyone else have intense emotional reactions even when it's not PMS time? A song, a sunset, a memory - can trigger a crying jag. I've never been a sentimental person as a rule, and never could be bothered to stop and smell the roses, so the speak, and now here i am."
2chr2015,2019-06-03T00:34+00:00,Dreading bedtime,Does anyone else dread going to bed because they know they are going to wake up with a hot flash and sweating at 3 am? i know it's getting bad when i don't want to go to bed!
sunaina1983,2019-06-03T13:46+00:00,Stomach Vibrations and Shaking,Helloo dear Friends how r u doing today ? Friends any one of u experiencing vibrations and shaking in Stomach before and after periods. sometimes ots too much sometimes less. its more observable when i sleep..i feel jerks in lower part of stomach..i feel as if i am sleeping in Local passenger train and my stomach is vibrating alot. Sometimes i feel shaking too Anyone facing same problem in Peri ?
may69987,2019-06-03T05:20+00:00,Menipose,"to all the ladies who is going through this stage do any of you got sensitevity to prefumes of strong smells i was just putting gas in my car and the smell of gas made me sick to my stamock and bad pressure im my ears and heat ,and some prefums when my husband use them i feel pressure and heat in my ears ,anyone one else have same symptom"
sophie76397,2019-05-19T10:34+00:00,Bladder pain,"Hi everyone - just needing some reassurance. i had a hysterectomy last year plus other investigative work (cystoscopy & laparoscopy) for abdomen pain etc - all negative. i am now experiencing bladder pain, like a throbbing pain and sometimes it hurts to pee - a real stinging feeling - does anyone else suffer from bladder pain. its been getting me down and worried now. many thanks"
charcey97,2019-05-31T21:08+00:00,Word finding?,"How many of you with Peri in your 40s have issues with word finding? Some days are better than others, but for the last couple of years, I have had issues being able to find the proper words in a conversation. especially when I am nervous or when I am doing something out of the ordinary like a presentation. I find myself stuttering as I’m trying to search for the word which is usually a very simple word that I should be able to find. There is some days it happens several times a day and some weeks it only happens a couple times a week. at times, I will even put a similar word in that does not make sense in the conversation at all. Four instance, I might say ""put the milk in the cupboard"" instead of ""put the milk in the refrigerator"". It’s very unnerving, and makes me feel like I’m getting early dementia or something. Anyone else find this issue haunts them?"
lori93950,2019-06-03T04:02+00:00,How long to get rid or BHRT MASSIVE WEIGHT GAIN !!!,i quit the hormones almost 3 months ago now and still the weight is not coming off !! i was 110lbs now 175lbs !!! i barely eat as have mono obviously cant work out due to that however ive never been over 135lbs in my life and thats when i was lifting heavy weights. im not only sick but fat cant fit into any clothes blood pressure always good now its elevated. im at the end of my rope !!! please somebody tell me how long for this water weight to drop off .... its not from calories!
renee61138,2019-06-02T15:51+00:00,Period Help!!!,Hello ladies. I tarted my period Friday night 3 days early. I woke up yesterday feeling a little anxiouse. which is normal for me. Lately my periods have been very heavy but not pain full. I started to feel dizzy yesterday which again for me is normal but now i also feel like my legs are like jelly. So now i have a combo of dizziness dry mouth jelly legs and feeling very tired. Has anyone had these symptoms on day 2 and 3? It's starting to cause me anxiety as i fear something else might be wrong however I'm sure its probably hormone related. Any advice ladies would be greatly appreciated as now I'm feeling very anxious.
Shana_P,2019-06-02T17:57+00:00,Neck Pain and Tightness as well as Head Pain and Pressure,"Hello Ladies, Hi Ladies Do you get Neck Tightness and a TightBand Feeling Around the Head around peroid time and during?"
sunaina1983,2019-05-16T12:29+00:00,Drunk Feeling in Peri,Helloo Friends Anyone also experience drunk feeling in Peri with out drinking alcohol . These days every time of day i feel like i am drunk fully and forcefully doing routine things... Head pressure..headache and off balance made my life worst. Its also Peri effect ?? Anyone feeling same ? tk
shylee,2019-05-17T09:31+00:00,"Peri and Burning throat, tongue and face","I can't find anyone who is having the same or similar burning throat, tongue and face symptom as me. I have a lot of other symptoms as i have shared before but would like to focus on just these right now. I have noticed the burning increases just before and through a cycle when it comes and as it ends. The burning throat is like having a really bad throat infection that never gets better but has flare ups, but there is No actual bacteria etc...... The tongue is burning mouth syndrome which feels like i have stuck my tongue in Boiling water. My face feels like its bursting with heat that wont go away, unlike the flashes that rise and fall, and a prickling under the chin.... my neck feels tight...... i'm having palpitations through my neck but no anxiety really...... I just want to cry because its all just too much, years and years of it . And i cant cry because i will get another migraine..... If i didn't have grandchildren I'm sorry to say but i wouldn't be here. I know that's a defeatist attitude, but right now i don't care. Is there anyone else out there suffering with this incredibly full on symptom?"
Guest,2019-05-31T23:40+00:00,Anyone else have mouth changes?,"i have weird question for everyone, do any of you all of the sudden notice you lose your sense of taste for salt or sweet and your mouth feels like there is a slippery coating with your tongue feeling kind of fluffy? Similar to when the numbness starts to wear off after a dental procedure. I have been dealing with the strange taste issue for 2 years and now i havent had a period since the beginning of February. But the strange tongue and mouth thing is beyond strange! During this time im generally nauseous and lightheaded and it will last for a couple of days then it wears off and i start feeling like i can eat again. Its driving me crazy! I noticed a strange mouth early in my pregnancies but nothing like this!"
2chr2015,2019-06-01T18:24+00:00,"Depressed, worrying, sahm almost empty nest","How I am feeling today. Any advice appreciated. Prayers too. My health anxiety is getting bad again. My husband gets up and goes to play golf, then comes home and does yard work etc. His energy is endless. Me? I sit in the house...worrying, googling, watching tv trying to distract my mind. I don't want to go out and shop. I try to think of what I enjoy doing...Gym? no, but i do it anyways. My youngest is 16 and driving now. Everything has been about the kids. It kept me busy. i am supposed to be getting my gallbladder out soon (this has been a few years coming) but of course I am going to obsessively and excessively worry about it and everything else. Does anyone else do this? Hot flashes are coming multiple times at night now. Is that making the psychological part worse?"
sharon03238,2019-06-01T16:12+00:00,Throat and neck,Does anyone else have a red burning throat and tight neck?
evi75119,2019-06-02T12:04+00:00,Tendontitis calcification shoulder,"Hello ladies, I couldn't stand the pain on my shoulder during last night and I went to emergency rooms. My official diagnosis is tenonditis calcification on my right shoulder. Has any lady sth similar? the doctor said that there is inflammation on my shoulder because my cells are trying to eat and absorb the calcification. I am afraid because according to some internet articles this kind of tendonitis is more common in people with diabetes! I do not want to develop diabetes but since peri started my glucose blood sugar levels have been affected."
crystals51917,2019-06-02T01:42+00:00,I FELT SO BAD TODAY! :(,"Yesterday I Felt a little like myself. TODAY has been horrible. Went to get a massage yesterday and today was bad. Low appetite, nausea, no energy, brain fog, head feels heavy, low back ache, depressed, blurred vision. I kinda feel like I did when I was pregnant 27 years ago but worse. I said to myself, there's NO WAY, menopause can be doing all of this until I come here and read the same symptoms from several ladies. I'm miserable! I am 52 and still peri because it hasn't been a full year since I at least spotted. I wrote my DR today to tell her I WANT an MRI of my head and back. This quality of life during this time SUCKS! I've cried a couple of times today and I don't know what else to do. I take my supplements which seem to help some days but today NOTHING kicked in. I HAVE TO HAVE A CHANGE AND FEEL BETTER!"
ruth24048,2019-05-17T15:58+00:00,Stomach problems,"I HAVE BEEN STRUGGLING WITH STOMACH ISSUES ON AND OFF FOR A WHILE NOW. MY ABDOMEN FEELS LIKE SOMEONE IS WASHING UP IN IT SOMETIMES, I ALSO SOMETIMES HAVE AN ACHE ACROSS MY NAVEL OR TO THE RIGHT OF IT. MY BOWEL MOVEMENTS ARE FINE BUT I AM GETTING QUITE DOWN OVER THE ABDOMEN DISCOMFORT. DOES ANYONE ELSE SUFFER PROBLEMS LIKE THIS AND DOES ANYTHING HELP?"
christine-Perim,2019-05-31T22:21+00:00,Ovulation,"hi ladies I am 49 and still ovulating but each month it is harder on me. i get cramps and brown spotting, fatigue , huge appetite, nightmares. its like a mini period. anyone else?"
evi75119,2019-06-01T09:44+00:00,extremely unbearable pain on my right shoulder radiating to whole arm,"Hello ladies, have you ever feel sth like that? I am on 6 day of my cycle and for the last two days I am constantly suffering. I cannot move my right hand at all! It is an awful neuromyalgic pain... I cannot write more....because of my hand.."
Jaynie12,2019-05-31T15:54+00:00,Help I feel like I'm alwayssuffocating ...I am loosing my minf,does anyone else have the constant feeling of not breathing. aniety. i feel like im trapped in bed
lynn41704,2019-05-31T13:10+00:00,MENOPAUSE AND PAINFUL INTERCOURSE,"I have recently been to see a gynaecologist privately regards constant burning, dryness and soreness around my vulva/vagina. and painful intercourse. She prescribed Vagifem, Yes VM, low dose Amitriptyline which were prescribed by my GP and have really helped. She also prescribed 4% Aqueous lidocaine to be used prior to sexual intercourse to ease the pain but my GP was unsure how to prescribe this so sent a query to the surgery pharmacist who two weeks later prescribed Vagisil 2% medicated cream which I dont think is the correct thing. Has anyone used 4% Aqueous lidocaine to ease the pain of sexual intercourse and if so how was it prescribed? and how to you use it. Thanks for your help and advice."
caroline62395,2019-05-31T17:44+00:00,Whooshing noise in right ear,"Hi everyone, For the last year I have developed a whooshing noise in my right ear, its so distracting and wakes me up at night. I have seen a ENT who said my hearing was fine, I also had a head mri and nothing was found. My GP listened to the arteries in my neck and said she couldnt hear anything worrying. The doctors have told my its nothing to worry about but it really scares me. Has anyone else had or do you have this issue. I have had so many issue with peri Im wondering if its just another symptom? Its sending my anxiety through the roof!!! Thanks Caroline x"
sandra87208,2019-05-31T00:31+00:00,Terrible dreams and sweats day and night,Hi all hope your all well. I havent been on in a while because I thought all this was over. Im 48 started menopause at 39 and I got that bad after Xmas after suffering with anxiety and depression for a long time I started on 50mg of seretril and I instantly started to feel better. But the last week or so everything is back with a bang as bad as ever. The worst is tossing and turning all night long and when I do sleep I wake from terrible dreams and sweats. I'm having these sweats all day and night now has anyone else had this happen to them. X
Barney3771,2019-05-31T12:25+00:00,Pain,Hi . I have been having right sided up back pain. Doctor said he thought muscle. Now I have developed under arm pain and top of arm . I think under arm is swollen. i have also developed lower left sided abdominal pain. i didn't have a peri because of hysterectomy. any one had anything like this. I'm worried incase it something sinster . but dont want to keep going to doc incase he thinks I'm a hypochondriac. 😥😥😥😥
heather29740,2019-05-31T15:06+00:00,Bleeding after polyp removed from womb,Just wondering if anybody has had a polyp removed recently. I had a polyp removed 2weeks ago and I am still bleeding lightly and as the doctor nerve came to see me after surgery and have been told the polyp was benign by a colleague of the surgeon who removed it. I have not had anyone to ask so I'm just wondering if any of you lovely women can tell if you have had this operation and know how long the bleeding will last Many Thnks
jilld27,2019-05-31T13:44+00:00,Flutters,"Hi ladies, does any of you have constant flutters in your neck , stomach etc ? x"
debra16694,2019-05-31T17:12+00:00,DESCRIBE YOUR HOTFLASH,"Ok ladies, i have been on this forum more times then i would like to admit...i am 7 years post, but bad symptoms only started maybe 4 years ago for me. In peri i always got the hot flash accompanied by sweating/heart palps & insomnia. i have now been getting almost nightly, and always between 2:00 am & 6:00 am a surge of intense heat and fairly intense burning body parts followed by sometimes a wave of cooling sensation , anxiety and sometimes nausea but really intense! is this a hot flash on steroids or is it something else entirely - i am getting concerned that that they seem to be getting worse and more frequent than less - ugh!"
debbie12340,2019-05-30T15:45+00:00,Hair thinning and generally dry,"Hi Ladies, I was wondering if there are any ladies on here who may be post Menopausal. If so did you suffer from hair loss and it just generally looking dry and horrible during Peri ? I was looking for a ray of hope that it had improved and grown back. I know there are worse things but its so lowering when you already feel like crap anyway. I already take Biotin and also Nourkrin Supplements, I think they have helped, who knows, maybe it would look worse if I hadn't taken them ? Anyway hope you're having a better day than me. x"
manicgrey,2019-05-30T17:25+00:00,Blood pressure meds,"So since this perimenopause started, my blood pressure has crept up to hypertension levels. It isn't crazy high, but a concern. At the last visit to the Dr., I was put on a low dose of Lisinopril to help bring that down. Guess what happened. With the Lisinopril, the hot flashes are now all but nothing. I've been on it a week and I've had two. Not even two a day, but two. I can sleep at night without waking up to throw off the covers, no night sweats. I didn't see that coming, but it's so much better. For those who battle both, it's worth investigating."
tracy33887,2019-05-21T16:54+00:00,Do I need to see a doctor,"ive been going through the menopause for about a year i dint know if its peri or menopause, ive bot had a period for about 10 months im having hot sweats and night sweats but am taking herbal meducines which i think helps, my worry us do i still need to see a doctor, im worried about future bone problems. i also suffer from a dry vagina which make sex uncomfotable any one any tips please"
leanne92870,2019-05-31T08:23+00:00,Sandrina of 0.5 mg oestrogen gel sent me insane .,I have just lived the worst 5 weeks of my life in a psychiatric Ward . my doctor put me on an oestrogen only gel sandrina of 0.5 mg and with in a few days I was showing signs of paranoia !!!! not too bad to start with but increasing by the hour x I am under the mental health team anyway but have been well for 5 years and their was nothing else that could have caused this reaction . this resulted iin a terrifying 3 week full on psychotice episode and now I'm in a psychiatric ward x anyone else sufferedas a result of this hrt. ..
sunaina1983,2019-05-30T13:09+00:00,How to Deal with ....,Helloo Friends Please Suggest me how to deal with Heavyness in Head and Off Balance issues of Perimenopause.....which is from almost one year constantly . How can one live normal life with drunk like feeling everyday ????? Sometimes I feel i am not in my own body...😭 What u tackle this ? Tk Sunaina
kim93615,2019-05-31T02:56+00:00,Hive,does any of you ladies break out in itchy hive well they swell up
staci88515,2019-05-24T15:56+00:00,Small victory,"As like many of the ladies on this forum, I developed intense anxiety and panic attacks after my first migraine aura aka introduction into perimenopause. Previously, I had a MRI and CT of the brain.. Today, I had an MRA scan. I am not sure why I was nervous having done a similar scan a few short months ago, but I was. There was anxiety leading up to the scan and I almost pressed the ""get me out of here"" rescue button, but I didn't. I know it may sound absolutely ridiculous to some people, but I will take this small victory."
nancys21,2019-05-29T21:00+00:00,Testosterone cream,Has anyone used a testosterone cream which improved libido? There are SO many different things online. Thought someone here could help. Thank you ladies!
renee61138,2019-05-19T16:28+00:00,Stomach issues Help!!,Hello ladies. I would like to hear about any digestion issues you ladies might be facing. So i was diagnosed with ibs 2 years ago and that was the start of my journey. Fast forward 2 years for the most part I have been symptom free I had to change my diet remove dairy certain foods are a no go. Well i hadnt had a period in almost 2 months then i finally had one. It went on wo a hitch i bled for about 9 days with another 2 days of spotting. About i would say 4 days after i started to feel unwell. Dizziness aching and sore muscles stiff neck. I don't need to tell you ladies you no the deal. Then my stomach started to act up it been a few days now and it is my ovulation week with yesterday being my highest pregnancy day lol..no babies here. Now to my question. I have had a gurgling stomach with a tremendous amounts of gas . Slight discomfort and extreme bloating in upper part of belly. pressure in between shoulder blades that comes and goes. And also Im having what i think is palps every once in awhile while but it feels more like a quick hard thud then done. But I've been extremely bloated so not sure if its pressure related. Just looking to hear others stories and suggestions. Sorry for the long rant just want to feel better.
pamela2016,2019-05-27T13:43+00:00,Symptoms went to a whole different level,right before this cycle i just had i ended yesterday i been having of course the off balance dizziness. but its gotten worse along with this constant feeling high i side my head anyone else experience this? its scary and very hard to explain not only this but im constantly hot and feel clammy no sweating and of course anxiety has returned on its own adrenaline feeling in my stomach. my body whole body is really having changes i cant do this much longer.
pam90720,2019-05-27T17:17+00:00,This off balance crap,is really.....REALLY getting to me 😦 
heather29740,2019-05-26T23:54+00:00,"Menopause, depression and incredibly overweight.!!!!!!","I've been reading old diaries and I've found the link between my depression and my menopause. I can read where I begun to feel hormonal and anxious and depressed as well, I have even got a chapter where I asked the doctor if my hormones were causing this and his words were no this happens to hundreds of women every day where something triggers an episode and I've not to worry in six months I will feel better. WELL 16 years down the line I am ten times worse with the anxiety and depression and I have a lovely nine stones of weight on my original body ( before some smart arse says that my hands weren't tied behind my back and I was force fed I know I eat cause that's my coping mechanism. I have been through peri menopausal ups and downs, mostly downs, where your bleeding heavily and your stomach is going haywire and you decide you don't want to go out for 8 of these years and your doctor says no connection between hormones and all of the above. I write this tonight cause I have a heavy heart as I am applying for a job that I am really good at and have applied three times for it and they don't reply. This will start off an episode of depression and because I've recently had post menopausal problems so the two of them will give me a doozy of a down time. Finally check your diaries and you won't believe the connections b between the brain and your body and just how geeky you were as a teenager. Sorry for the outpouring but really struggling tonight. Thanks again for reading my s**t.......... Heather x"
