Author,Datetime,Title,Content
susane84679,2019-05-28T14:49+00:00,WE HAVE TO TAKE CONTROL!,"Hello Ladies, I hope you all are having a good day so far.I want to start off by saying that I am in no way diminishing our symptoms or how we are feeling on any given day. This Hell we are all going thru is rough to be sure and we all struggle with many of the same symptoms. We can not let This control our lives, we cant let it dictate where and when we go somewhere. I know that several of you ladies are moms to younger children and you have mentioned how you have pretty much given up on being the mom they deserve because of how you are feeling from one day to the next. DO NOT DO THAT!! We have got to take control of our lives and not give in ( although that is the easiest thing to do) it is not easy but we are women, we are strong and we will persevere ! We have got to accept that menopause is what we are going thru, not who we are. It is a phase of our life and will not last forever. I think the most common complaint is Anxiety. I suffered with this for years before meno, until I decided it would not control me any longer. I was afraid to leave my house because of it. So, I got off the meds and started doing things I enjoyed before, it did not happen overnight but it did happen. I had to train myself to think differently and when anxiety reared its ugly head I kept moving forward and refused to let it stop me. I have not had an attack in years even going thru meno! We have to take control of our symptoms and our lives Ladies, we can not let this hell win! I know how scary and difficult this journey is because I am going thru it myself, with many of the symptoms you ladies suffer from but I have a normal life because I refuse to let it control me. I absolutely have bad days but for the most part they are good. I am not saying anything negative about how someone else is dealing because we are all different, I am just sharing my story because I want all of you to know that you can live a normal life while going thru peri/meno, but that it's up to each individual to decide when they've had enough of missing life and how they will get it back. Hope all of you have the best day ever and sending hugs to all!"
kim93615,2019-05-27T12:43+00:00,Hive,"hi, ladies does any of you ladies break in hive itching if you scratch it you Swell up and you itch so bad. I am going through menopause I had not seen a period since 2016, its three years not I get the ringing in my ears. some body please me what to do its drive me crazy."
lisa17089,2019-05-25T19:35+00:00,Brain fog,"I've posted on here before about brain fig but omg it's terrible. I'm really worried I'm losing my mind. confusion, forgetful, writing wrong dates on things, counting things wrong at work, picking things up and seconds later dont know were I've put it. its worrying me. anyone the same xx"
jilld27,2019-05-28T16:17+00:00,Heart Skips a beat,Hi ladies do any of you notice that your heart skips a beat ? Is this normal and part of the meno ? Does anxiety cause it x
hopeforever,2019-05-28T12:14+00:00,Feeling like my throat is closing in. Is this normal ? HELP,Ladies i just woke up and i am in panic mode. I am trying to keep myself calm by all means. My throat feels like it is closing in. My throat feels weird. I cannot explain. I also have dry mouth. I never had this before. I am drinking plenty of water. I want to run out of my body. I am so scared right now. Is this a part of peri and meno ?
nancys21,2019-05-28T00:00+00:00,Hysterectomy,"Just looking for some thoughts from you lovely ladies. Just about every woman in my family has had a hysterectomy at an age younger than I. I'll be 51 in December. Was told at 22 that I needed one, due to severe endometriosis. I wanted to have kids, so had laparoscopic surgery by the 2nd gyn I consulted, to remove the adhesions. Had my son 10 years later. Bled heavy again until almost 2 years ago, when I went through menopause. Peri menopause was hell since about age 43. Now my lining is about 2x what they say is okay as far as cancer risk. I've been living a menopause hell. Don't see why not to just have the hysterectomy and be done? I'd like to get on bhrt (after the procedure), as I don't like the idea of horse urine (hrt), and I've decided that pellets just aren't for me. I'd rather try compounded creams or just live with the BS these golden years have become. Thank you in advance for reading this, and any words of wisdom/advice. My best wishes to all of you! Nancy"
sunaina1983,2019-05-27T05:52+00:00,Too Much Weakness in Legs,"Helloo Friends. Any one facing weakness and pain legs in Peri? Some days Weakness is soo much that its difficult to walk in home ..From Yesterday i am holding things and walking few steps upto washroom....having pain in legs too. I feel I am not 39 years i am 80 years old ..always need support to walk and after few steps feel tired and feeling pain in legs..want to seat after few steps only. Anyone Experiencing this in Peri ? I have all other classical symtoms of peri too..Head pressure, heavyness in head, headaches, bloating , weakness ,leg pain Mood swings,depression ,Heavy and painful periods list goes on and on 😭 Donot know when this all will end and I feel like Normal again . Every morning tell myself it will go..HANG IS THERE..ITS phase of life will pass..BUT some days ask myself WHEN ???? I have No ans for this and feel depressed . Waiting for better days. tk Sunaina"
2chr2015,2019-05-25T13:25+00:00,Not a night sweat but waking up hot in the morning,"hi ladies. i have had the occasional night sweat and hot flash during the night. But lately, I have been waking up hot in the morning. sometime a little sweaty around my neck but mostly just really hot. I'm not sure if it is waking me up or its just time to get up, but it is every single morning Anyone else?"
pam90720,2019-05-27T17:02+00:00,Passion Flower,hi ladies have any of you tried Passion Flower for anxiety? ty❤
sherry26257,2019-05-27T08:16+00:00,Prolonged period,"Hi ladies, im at my wits end as i have had bleeding for over 3 weeks, i have had changes in my cycle for a couple of years now heavier, big clots, longer about 9 to 10 days mid cycle spotting , then last year i started spotting all the time, had vus ,hyscoroscopy and biopsy, all came back fine had a 3mm submucosal fibroid which was causing the spotting, wasnt offered any treatment but it did seem to settle for a while, then this christmas i came on 10 days early spotted for 10 day then bleed heavy for another 10 then it stopped, then periods got closer together 23 days apart instead of 28, then beginning of this month i started spotting when i was due, that carried on for 10 days then the proper bleed started and has been going on for 9 days, before this period i woke up with the worse night sweat soaked from head to toe, im 46 and my mum had exactly the same , she stated perimenopause in her early to mid 40s, i just wondered has anyone had a similar experience and how did you get the bleeding to stop . many thanks"
evi75119,2019-05-27T12:31+00:00,"A non scientific ""hypothesis"" for my low estrogen deficiency symtpoms","Hello dear fellow-sufferers, it has been a long time since my last post to the forum. I am still struggling with symptoms but I am trying to become more positive about this and accept my situation without loosing my hope for a miracle. The last few days, I made some thoughts about this phase of my life and I would like to share them with you and tell me your opinions if you want. Well, in the past, I used to laugh at conspiracies but with all the "" weird"" and more than normal scientific advances on nowadays I was wondering if New World Order schemes have affected women's health, hormonal imbalances, premature perimenopause with more intense symptoms than our mothers. I do not mean only chemicals in food and modern life style but I was wondering if the plethora of satellites around us along with the ability of military and space organizations even to remove and affect the conditions to other planets for their geopolitical schemes have affected the function of our bodies and may accelerate ""idiopathic"" autoimmune health problems relate to our hormones and metabolism . Not mention the vast amount of radiation that we are exposed to!!!! As you know the moon has a direct influence especially to women behavior and menstrual cycle. I recently have read on the Internet an article about the shrinkage of the moon ( like a raisin) along with recurrent earthquakes !!! I know I seem crazy but I would like to vent my thoughts. thank u all!!!!"
susan39015,2019-05-27T13:12+00:00,BHRT? I know this has been discussed but I'm confused,"I know this has been discussed but has anyone tried bhrt and if so do you feel better? That is the better one to try correct? Im usually an obsessive googler but I dont even want to do that so i figured id ask you ladies who are suffering just the same. Is that something that can be used long term like the rest of your life? Im 48. I dont even know where my hormones are at. I went for a gyno visit last august my first visit in 6 years due to high anxiety. She was young, when i explained all my symptoms she looked at me like i had 3 heads and asked if i talk to anyone. She said there were really no accurate tests for hormones and what im experiencing could be hormonal or stress. I wanted to lunge over the room and throat punch her, God forgive me. Are there less side effects wth the biotentical? whats it from, im so confused."
sunaina1983,2019-05-25T05:17+00:00,Is Dryness also Peri Symtom ??,"Helloo Friends How r u doing today ? Friends i am in Peri from last year having all classical symtoms. most scary r dizziness, head heavyness , shaking and off balance issues. I am facing this from last year . But new symtom started from this month. I am having alot of DRYNESS inside Noise , Ear , vagina and skin these days . While sleeping also i feel too much dryness in noise.habing very strange feeling inside noise 😭 IS THIS ALSO PERI EFFECT? ANY TIP TO OVERCOME THIS ? HUGS Sunaina"
lisa67356,2019-05-22T17:28+00:00,Any one else getting spots,Hi Ladies im in peri and one of the things i am getting is spots on my face im 45 and didnt have spots as a child they dont contain puss just water they remind me of cold sores but i have has them tested and they are not cold sores has anyone got them i have tried lots of medication but nothing helps
Yogio1,2019-05-26T22:13+00:00,peri menopausal,"Hello, I'm new to this forum but i find it very helpful. I have experience most of the symptoms, but going through a rough time with my anxiety and also depression. I feel like I'm dying half the time. My family some what understands but they are supportive. I have a question has anyone experienced any tingling numbness on chest or back? Sometimes goes all the way to my scalp. Sometimes feel spots of tingling in my arms too? Could this be a sign of B-12 dificiency?"
mary27278,2019-05-04T15:03+00:00,Feeling of Depression,"I am getting so depressed from dealing with these symptoms. Why is it that I'm feeling ok at one moment and the next it all comes back. My hormones has to be extremely low..these hot flashes are really getting to me. My digestion is so messed up, just pressing on my stomach gives me a hot flash along with heart palpitations. I hate the way that im looking..i look so old, skinny and fragile. I know most of the women are gaining weight, what i would give to gain a few pounds. I've lost so much weight and can't gain any back because I can't eat the foods i want. If i attempt to eat sweets or carbs the candida goes overboard and hot flashes. I have so much going on... so depressing watching others by-passing all this misery. 😢"
cindy17746,2019-05-25T14:30+00:00,Fatigued and scared,"HI ladies. I feel like I've been on here a lot lately, but my peri is really putting me through the ringer lately. I am experiencing extreme fatigue today. Feel it everywhere, even in my face and throat. Running to bathroom as well. And crying, because it scares me. Just reaching out to you because you help me"
pam90720,2019-05-22T12:19+00:00,Mornings,anybody else have rough mornings with anxiety? my whole body trembles.. racing heart and thoughts? so tiring 😦
kim35797,2019-05-25T06:31+00:00,peri or menopause,Hi I have a broken tooth which is really sensetive any thing hot or cold will make me scream i have had to wait for my dental appointment for a month as my dentist is fully booked . But also strange that i also keep getting pain in my jaw and ear it feels like every tooth is hurting .Is anyone else going through anything simular at all i hate being in pain like this taking tablets to help the pain everyday !
pam90720,2019-05-22T16:37+00:00,Citilopram,"hi ladies, have any of you tried or are you on citilopram? i tried lexapro for 4 days couldnt handle it 😦 thanks for any feed back. hugs to all ❤❤"
susan39015,2019-05-24T18:13+00:00,Just Me?,"Does anyone feel like theyre losing it? Like legit going crazy- no joke. Honest to god the tight pressure feeling in my head face nose eyes ears and tightness in neck feels like it paralyzes the rest of my body, fatigue, digestive shuts down, walking feeling like im drunk, yet im overstimulated and jumping out of my skin. Makes me wonder if im just a poster child for mental illness. The envy i feel over ppl just living their life enjoying things is killing me. Which i know is wrong and im ashamed at myself. This is all fking killing me. Its like which came first the chicken or the egg- did genetics, anxiety and depression cause all these issues and throw off my hirmones or did hormones cause all of the above. Im sorry just needed to vent feel like im going to explode. Im 48 i feel like im 88."
Mayfly1,2019-05-20T05:59+00:00,Lloyds phamacy has supplier issues,"I tried to get my usual HRT (Ellest Duet) two weeks ago, only to find that Lloyds has ""supplier issues"" so I can't have it. They haven't told anyone, so I ran out and then spent over a week re-applying to my doctor for another prescription which was supposed to be based on any HRT that Lloyds DID have, and then spent another 3 days waiting for that to come in. So, first point : I ould advise making sure you have an adequate supply before asking for more. Secondly : do the side effects of Novofem go away? I've only taken 3 tablets and so far I have flatulence and I am still getting hot flushes. I think I may have bloating as well, but as I had to stop taking my HRT in the middle of a ""period"", my body is now completely confused. I just want to go back to my lovely Ellest which gave me no issues whatsoever and apparently even caused me to lose weight whilst I was taking it, but I guess that's not going to happen...."
chrissey,2019-05-23T11:33+00:00,Help,"I've just been diagnosed at 47 and feel like s--t so angry feel like the world hates me, I'm thinking about hrt but mg mum had breast cancer 17 years ago any advice gratefully received"
may69987,2019-05-23T17:17+00:00,Perimanipouse,"to all the beautiful ladies ,did anyone had ana blood test and it came positive i did it two years ago and it was positive but i did some other test and they were negitive so the doctore told me not to worry about it ,but i did again the test and it is positive which will always be and i did the other two blood test ENa and DNA and im waiting for my result ,my anxity is to the roof so scared ,i was wandering if anyone had the same problem ,please"
pamela2016,2019-05-23T23:47+00:00,Head posture,im starting to think some of this head dizziness thats with me 24/7 is my head posture im always head forward on my phone playing games. its effecting my vision as well and ive noticed that its worse on cycle so i know some of this is hormones. ive made an appointment with a chiropractor to try and see if it will help. so fingers crossed i get this figured out as its done took a toll on me.
becky21031,2019-05-14T03:53+00:00,Anxiety before period,"Im 42 and obgyn thinks Im going through peri. The thing that bothers me most is the anxiety. At 40 I suffered my first panic attack outta no where. I went to ER. Then many times after. They put me on sertraline. A year later I went off it. Now Ive pinned down the anxiety to the day or 2 my period begins. Anyone else have this issue? I feel like a crazy hormonal lunatic. Oh and ever since I had that first panic attack at 40 I cant go into big stores or crowds. Its too much stimulation and I get anxious. 2 years ago an ENT said it was vestibular neuritis which goes away in a month. But now looking back Im thinking this has also been my crazy hormones. These have been my symptoms since age 40: Brain fog, anxiety, heavy periods, fatigue, forgetfulness, longer cycles, sore breasts more frequently, intense cramps, stomach issues. So ya I accept Im changing. It sucks. The anxiety bothers me most. It can be crippling. Anyone else experiencing this? How do u even deal with it? Thanks."
ampat1,2019-05-21T22:42+00:00,When will this end?,"just when I think it's getting little, tiny bit better I get slammed with a new symptom or current symptoms get worse out of blue. I had an ok week last week, symptoms were more manageable. but all of a sudden today my headache started, I feel heaviness in head, especially the right side, my ears ringing more, I feel nauseous and all this spiked my anxiety through the roof. My period just ended few days ago. It's like peri is playing mind games with me. So sick of this crap, I can't plan anything since I never know how I will feel based on my symptoms. I feel frustrated, it's robbing me from my family time and life just in general. I am always agitated, I am losing my friends since I keep away from social life because I have no energy or motivation. Anyone else experiencing all this? my headaches, ear ringing, head pressure, anxiety are just a few symptoms, there aremany more. I feel I lost my ability to cope with even slightest stress of daily life."
Bindisid,2019-05-22T12:31+00:00,Blood pressure fluctuation during cycle,"hi everyone...i am 46 year old going through horrible perimenopause. i get following symptoms during / before the cycle or mid cycle: high bp goes upto 140/95, dizziness, palpitations, severe anxiety (due to which i lost lots of weight), tremor, shakiness, extreme fatigue. all the blood report is normal other than low ferritin. i dont take medicines for my high bp as other days its normal. does anyone go through like this? I started having these symptoms 4 years back. doctor has just prescribed b complex. have tried homeo ayurveda but nothing works."
christine-Perim,2019-05-20T18:31+00:00,Too sum up.....,just want to sum up ..... gave up food gave up drinking hardly any sleep exercise takes all my energy and i am sore for days no sex drive i am lucky to poop bloated more than not soft squishy boobs huge appetite always freezing chin whiskers late periods early periods feeling drunk forgetful compulsively regretful uninterested in cooking for family no social life pimples that wont pop and take forever to heal anger over normal aggravations sensitive mouth AM I MISSING ANYTHING??
heather29740,2019-05-21T23:43+00:00,Menopause or life.........,"I have to as some questions and some answers..... Well I have health anxiety but was it there before menopause, don't know it's about the same time, but my dad died then I found out I have a genetic disease that is easy to live with if treated. Here's another sore legs pain in joints , sometimes due to Menopause but also part of my disease. Yet we have another depression was that the menopause or was it the fact I couldn't bear to go out anymore. We have the biggest one and no pun intended , weight gain was it the menopause or was it the fact that I am so effing bored that I eat all the time and yes my confidence has gone but I don't think I had much in the first place. Finally as from today I refuse to blame all my s**t on the menopause, instead I'm going blame it on Brexit , wtf it's blamed for everything else.........and drop Mic.........."
hopeforever,2019-05-06T06:55+00:00,"Terrible night. Nausea, vomiting, dizziness, shaking, internal shaking","Tonight by far is one of the roughest nights. I never experienced this before, nausea, vomiting,dizziness, shaking. I had to call my son to come over and help me. I was fine this morning and i was hoping for a good day then around evening, stiff back, fingers and now this. I feel like going to the ER but my son thinks it will just be a waist of time. Since January i have made so many runs to the hospital i lost count. I cannot believe this madness. It scares me out of my mind. I have so many bad thoughts that i try to quickly push aside because then the panic and anxiety attacks. Can all this really just be hormones. I do not no who this person is anymore. Never in a million yrs when i rang in 2019 would i of ever thought this dread was waiting for me around the corner. Someone please tell me they had this symptom. I am scared out of my mind. Thanks"
DearDoe,2019-05-19T05:03+00:00,More days in a month bleeding then not,"If I am not having a 10 day period, I am spotting. i have spotting or a period more days of the month then not. i am almost 48. I know I started perimenopause at least 7 or 8 years ago. it has been a rough road. this all the time bleeding thing started and has been on and off the last 5 or 6 months. anybody else have this problem? And yes,, I have seen my obgyn, had an ultrsound and a uterine biopsy."
juanita93228,2019-05-03T21:48+00:00,Weight loss,"I cannot believe I'm saying this since I have struggled with my weight all my life. I've loss 20 pounds over a year. Granted, I don't eat much, because menopause has stolen my appetite and food doesn't taste as good. But I'm concerned about the big ""C"". I've been to the doctor and all my blood work was good. They even lowered my BP meds because I had lost weight."
sharcerv52408,2019-05-16T18:49+00:00,Strange symptoms,"Hello Ladies, Have any of you experienced constipation with bloating and gas for a few days and then soft stools with nervous stomach issues? I was feeling constipated most of the week then today I had soft stools and a jittery stomach. I felt so fatigued today too. I feel like I've been run over by a truck! This is awful! 😩"
cindy17746,2019-05-21T13:58+00:00,weakness and cloudy brain,"Hi ladies, I have been experiencing a new symptom for the last week or so that is really unsettling. It feels like my brain is trying to send messages to my body that my body isn't properly receiving. My legs feel like jelly, and muscles all over feel weak, almost paralyzed. I find even speaking to be a chore- like I have to really think about the message I want to convey to others. Is this normal? Some days, it's worse than others, some days, non-existent, but some days, like today, it's very overwhelming. I have a very cloudy brain too. Hoping it will pass, but wondering if anyone else has had this issue? I'm concerned!!"
pam90720,2019-05-21T23:47+00:00,I feel like a pin ball,in a pin ball machine!!!! so off balance having to hold on to things to walk!!! i feel like a drunken sailor!!! i had to go to Walgreens just now and I was scared to go!!!! 😦(( feels like for a split second i could black out!!! feel like taking a damn xanax and going to bed!!!!!its only 7:00 pm!!! im so sick of this crap I could scream!!!!how are we to take care of our families like this!?!? 😦
marisol06794,2019-05-18T08:23+00:00,Fluttering heart jumping at the drop of a needle.,4:10am and can't sleep i try laying down and there comes the fluttering and weird feeling in my chest so i sit up and it goes away also i have a weird pain under my left breast upper rib cage I'm thinking my heart and it's scaring me I'm also sick with the flu my sinus is horrible but what's really worrying me is the fluttering and pain I'm sitting in bed and it stopped but once i lay down it starts up again can any of you ladies relate to this this is really worrying me.
