Author,Datetime,Title,Content
staci88515,2019-05-01T10:12+00:00,Energy surge,"Does anyone else feel anxiety and then this incredible surge of energy during a hot flash. I don't get too hot nor sweaty, but I get this wave of intense anxiety followed by my body/mind going haywire. My heart pounds out of my chest and my pulse increases. It is so hard to describe. It is very intense, like this energy is just running through my body. It makes me dizzy and faint. Oh, and it is hard to breathe through it. I have seen women say they are having a hot flash and they just get red in the face and sweaty. To me, it is not that at all. It is a surge of energy that is all encompassing. I cannot function during it. I just have to try to breathe through it and not fall to the ground. Anyone???"
Guest,2019-05-04T16:50+00:00,24/7 365,Can I just ask if there are any ladies that suffer night sweats and flushes every single day and night. I have had these now constantly for 4 years and haven't had a single day or night without at least one. They are less frequent but daily really? Long to be cold. Thanks
Guest,2019-05-05T14:05+00:00,Just Give Up,"Hello I have gained weight and no matter what I have tried its just not for budging. I was wondering if there are any ladies that have gone through menopause where the weight just came off again later on. My mum said she put weight on then it just came off later of its own accord without any dieting, anyone else?? Or am I stuck with my buddha belly forever?"
Barney3771,2019-05-05T14:11+00:00,Hrt,Hi all. went to doctor due to all the pains. she says alot of it is over thinking too much. she has give me citalopram & Evorel 50g patch..but I'm warying if using it due to big c risks with it. looking for pro &cons of anyone who has used this patch before or currently is please.
nanc00951,2019-04-16T11:50+00:00,Morning Weepiness Advice,Does anyone have advice for the mornings and the weepiness that cones along with them? it is so hard to get started while feeling so down I have a constant anxiety and this horrible weepy mornings THANKS in advance for any help
Guest,2019-05-02T13:53+00:00,Not sure there is answers,"I had a hysterectomy (quarter of 1 ovary left) back in 1995, and since late teens have suffered from hypothyroidism. In retrospect I should of noticed that I wasn’t feeling the cold as much, getting hot when doing any work and waking hot in the night. In 2014 my lovely husband passed away out of the blue and for 2 years I was in complete denial. In January 2016 I began feeling really low and depressed and thought that maybe I needed some help, but before I could BOOM! I started with what I thought was a tummy bug and it all went down hill from there. Within the next 6 months I went to A&E 6 times and was MISdiagnosed with anything from crohns to overmedication of thyroxine. It was then I went to see an endocrinologist privately to sort out my thyroid, best thing I did he actually listened! Well I wasn’t overmedicated at all but he did tell me that with my age hormonal shifts can affect thyroid, it was then the penny dropped I did a bit of research, of course what an idiot I had been MENOPAUSE!! I also decided to seek help from a therapist and discovered I was also suffering from complicated grief, anxiety & PTSD, who I still see to this day. I am certainly much better now and each year gets slightly better. My symptoms of which I can remember : No appetite – I couldn’t eat or drink much for around 6 months all I managed was ice chips and an odd bowl of rice I nibbled on crackers. I lost nearly 2 stone in this time. Bowel and stomach pain which was crippling. 24/7 Nausea just awful. Heat Intolerance- couldn’t stand heat generally, no hot showers only cold and couldn’t bear a hair dryer. Insomnia – 1 to 2 hours sleep at best. Difficulty swallowing – like my throat had something in it. Dry mouth. Tachycardia Diarrhoea for months on end. Weight gain -well the 2 stone I lost turned into 3 stone gained which won’t budge now. Tiredness & Exhaustion. Anxiety, Anxiety,Anxiety Oh brother! Where to begin. I turned into gibbering wreck and became agoraphobic. Chest tightness Pounding heart Restlessness Emotional/Depressive Brain fog & lack of concentration Loss of confidence even afraid to drive ( been driving over 30 years) Constant headaches Tremors and shakes both internally and externally Brain zaps. Hot Flushes & Night Sweats – these were continual one after the other 24/7 I have probably forgotten loads. I am guessing by now I am probably post menopausal. All I can say is as time passes symptoms get a bit easier, and others disappear if only we knew which ones and when. ◦"
Barney3771,2019-04-27T21:27+00:00,Upper back pain.,Has anyone had any upper back pain.. im having right sided upper back pain under arm and slightly down arm .. it's all sore to touch. That with really bad fatigue and nausea. in demented.
hopeforever,2019-05-06T00:23+00:00,"Chronic Stiff upper and lower back and neck, fingers Help","Ladies for the past 4 hrs i have been experiencing chronic stiffness in upper, lower back, neck and fingers. Its like my muscles are stiff. I tried stretching and a hot bath with bath salt and still doesn't work. Just finished having a bad anxiety attack because of too much thinking. I am cried out. Please help"
debra16694,2019-04-11T03:13+00:00,WEAKNESS IN LEGS,"OK ladies, i know i have been on here a lot lately, but i am getting concerned. In December, i woke up with an extremely sore knee (no injury) & i babied it until i was forced to get an MRI & ortho appt. Aside from almost being bone on bone on my right knee (cortizone & knee exercises are helping) what is concerning me most is my inability to almost walk. i am almost crippled when i get up out of bed, or after prolonged sitting, i just cant walk very far anymore. i feel like my muscles, tendons & ligaments have all given out in my lower legs. i know this is not true because i am able to stretch and work my legs during exercise. It is now going on 5 months & its frankly flipping me out. i am 62, 7 years post menopause, far too young to be feeling like a 90 year old - can this really be from the lack of hormones? help if anyone else is experiencing this -"
jane63977,2019-04-22T15:25+00:00,Bowel issues,"Hello all you wonderful ladies . So , yet again as one symptom goes , so more come along . Every month after my period I seem to have problems with my stomach that include lack of appetite , gas , bowel problems and feeling under the weather generally . This time Ive also had a migraine . Eventually my appetite comes back and then I get another period and its back to square one . So fed up and now I have an ache as Im ovulating as well . All my blood tests have come back good , but still I keep thinking stomach or bowel cancer . Both my husband and daughter have said that I should stop worrying as its only my perimenopause causing this , but my health anxiety goes into overdrive . I think throughout my life I have suffered with ibs on and off plus I have a small pile that plays up and bleeds when I am like this ( sorry for tmi ) . Please does anyone else have issues like this as I am fed up of feeling poorly . I am 51 and still have regular periods . The past few nights I have had night sweats as well ."
Guest,2019-05-04T16:12+00:00,Beaches,"I was watching Beaches, old 80s movie with Bette Midler. Decide to google (I know, I know) viral cardiomyopathy, sure enough I'm convinced I have it now. Logic tells me that I don't because I saw a cardiologist and even wore a monitor for 24 hours, but then I think maybe they missed it. Why do I torture myself so?"
hopeforever,2019-05-04T16:48+00:00,Popping and cracking bones driving me crazy,"Since Wednesday i have been having cracking and popping sounds in bones. Wrist ankles hips neck. It is driving me crazy. Has this happened to anyone, if so what can i take. Thanks"
lori93950,2019-05-02T18:02+00:00,Massive weight gain on hormones!,was on mylan estradiol patch 5mg and progesterone pills 50 mg for about 8-9 months gained about 40 lbs ! was 110lbs to begin with. not sure if even helped me as i have ebv mono too . they made me calm to start anxiety lessened but then stopped working . is mylan hrt or bhrt ? has anybody else gained weight ? i may go back to the vaginal cream as i know thats def bhrt . right now waiting to lose the weight before i reassess things.
jane63977,2019-05-03T07:47+00:00,What is wrong with me ?,"SO FOR THE LAST FEW DAYS I HAVE HAD NUMEROUS PAINS FROM MY STOMACH TO BACK AND UPPER BODY . NOW I FEEL SO HOT AND LIKE I WANT TO PASS OUT . I HAVE A PERIOD DUE ANYTIME , SO IS IT DUE TO THIS ? I AM 51 .SO WORRIED I SHOULD GO TO A &E"
heather29740,2019-04-20T02:07+00:00,Polyps,Few weeks ago I told you I had post menopausal bleeding they gave me a smear that's normal and I went for an ultra sound up to check my womb. Well she told me there was a polyp on the lining of the womb and took a scraping which were described as a biopsy got a letter yesterday normal cells. Now I went up to hospital on Wednesday I thought to get it removed and was told that the polyp would need to be removed by General anaesthetic but she went ahead and got her young male gynaecologist to probe where it was and get a biopsy. I will now get to my point why didn't they leave it and get it checked when they were going to remove it was this just practise for the younger doctor. This waiting for test after test has got my anxiety off the charts. Sorry for whining but it's better than lifting up an item and throwing it through my window to relieve my anxiety and much cheaper. xxx
VSF1918,2019-05-01T21:19+00:00,Peri w/Endometriosis. No period 4 mths then heavy bleeding 30 days and legs aching. Please,"Is this peri w/endometriosis? Turning 49 this month. No period for 4 months then bleeding heavily for 30 days, not spotting, but bleeding. Both legs feel like flu aching, like when period began as a teen. Endometriosis history. Did not have a cycle for 4 months. Bled rectally, kind of a lot of blood and dr did exam and said had a hemorrhoid at entry of rectum. Said could be diverticulitis. Gave antibiotic. A few days after on antibiotic, began bleeding vaginally, after no period for 4 mths. Ultrasound over a few days showed wall thickened from 11 to 14 in one week in from 2nd week to 3rd week of bleeding.. Appeared no more bowel blood after vaginal bleeding began. Saline ultrasound showed no polyps or fibroids. Biopsy completed 5 days ago. Colonoscopy scheduled in 4 days. Dr recommended hysterectomy and preferred having colonoscopy done before in case endometriosis encroached. Nurse said colonoscopy is needed bc heavy bleeding 30 days is not normal. I've read on here some people do have it for a long time after not having a period. Period history, heavy and painful periods. Always on time and no breakthrough until last couple of years and dr said it was normal to expect spotting in cycle approaching Menopause . One year ago, I was bleeding some during pap and it came back abnormal and biopsy then showed clear. HPV was done and it was negative also. Could antibiotic have triggered hormones or something to trigger shedding of uterine lining? Anyone have endometriosis during peri with heavy long bleeding? Anyone have leg pain during Peri or Peri and Endometriosis? Please anyone having peri issues like me?"
Kadija1966,2019-05-02T15:36+00:00,Lower back and abdominal pain. Is it menopause symptoms?,"I have lower back and abdominal pain on both sides of abdomen. I also feel bloated, lots of gas, I feel tired. Have had scans on my abdomen last month and doctors say it's all clear. I'm not sure if I lifted some heavy bags that could be causing this. As it happens after lifting the bags. I'm not sure if it's meno related? I've missed my last three periods. Not sure if the pain is associated with my ovary. I also have small fibroids. I'm so worried."
pam90720,2019-04-30T09:38+00:00,Mornings,&$)/:)$€>#{|€£><~%>>•£>|^#^#<+>%#!!!!!!!!!!!! who else is with me??
hopeforever,2019-05-02T04:07+00:00,Considering Bio identical hormones. Is anyone taking ?,"Today i spoke to a woman and she told me that she was suffering for many yrs and a friend of hers suggested bio identical hormones. She gave them a try and said it was a life changer and the best thing she did. Tomorrow i visit my naturopathic Dr and this will surely be a discussion. I know i need something, my quality of life is gone. Tonight i experienced shortness of breath only walking 2 blocks scared me to death only to turn right back around and go home. I cried all evening. Everyday something new. I cannot function in this horrific state and the very thought of living like this for yrs is a hell which i do not want to live. I am 44 still young and i need to get my life back to some kind of normal. Has anyone tried it or is on it ? Hugs to all in this hell"
sharon03238,2019-05-01T18:50+00:00,Allergies,Has anyone else got really bad allergies and sinus pain? x
ampat1,2019-05-01T18:55+00:00,Anyone else have ear problems in Peri?,"hi ladies Is anyone else having ear problems in peri? I have been getting ear pressure, ear fullness, ringing. It constantly changing but I never get a break from it. I noticed I used to get ear fullness around my periods but now it's just random at any time of the month. Not to mention the constant headaches I have since my peri anxiety started. I do take allergy medicine and nasal spray but not much difference in my ear symptoms. Is this another annoying peri symptom?"
sharcerv52408,2019-04-30T17:23+00:00,Ovulation woes,"Hello all, I haven't posted anything for a bit. I guess that means that I am just getting used to these symptoms or they are getting better. I do have a question. Do any of you get pain in your lower back above your butt cheek when you ovulate? The pain kind of radiates into the hip and thigh. Since Sunday I have been feeling gassy, bloated, constipated and as of last night I have been having the lower back pain. I calculated with my period tracker app and it seems to be pointing to the signs of ovulation. Have any of you had this?"
AJacynM,2019-04-28T13:16+00:00,Has anyone tried Kelp supplements to aid hormonal issues?,"Hi all, Just wondering if anyone out there has tried taking Kelp to help with meno symptoms? If so, how did you get on with it?? Ta! AJ. xx ps hope you're all having a great day, I'm currently sat sweltering in an indoor water park as I can't join in the fun with my fam as my body is now reacting badly to chlorine etc... just another meno symptom to pop up! ☹"
heather29740,2019-05-01T23:00+00:00,Any Ideas !!!!,I would like to know if anyone can help. I started post menopausal bleeding six or seven weeks ago was sent for smear that came back normal then I was sent for vaginal ultrasound which said there was a polyp and they took a biopsy of the lining of the womb that came back normal cells. They then told me I couldn't get the polyp removed under local anaesthetic so the doctor got her junior doctor to take a biopsy which was horrendous as the young man couldn't get a large cut of the polyp ( oh God did he try to the point he was hurting me) so that biopsy couldn't get cells off it to small a sample. I shall now get to my main point I have been told I can't get the polyp removed by General anaesthetic as my b.m.I. is to high in otherwards I am too fat and they can't take it out by local anaesthetic so what I want to know does anyone have any ideas ( the lovely Kerry whom I speak to on the forum suggested spinal block) what else I can get . Your help with this query would be much obliged........ Heather P.S. Can you live with polyp in there or is it best it's removed if only to stop the bleeding.
pam90720,2019-05-01T14:53+00:00,:-),Click here to view image
christina81747,2019-04-30T10:23+00:00,Morning anxiety,does anyone else wake up body feels like shaking and nervous sweating and panic feeling? I dont usually wake up like this but iam a fee days from my period do you think that is what it is? I woke up at 4 sweating and shaking heart racing then at 530 shaking as well and panicking wanting to cry
heather29740,2019-04-30T17:25+00:00,What Next ???,"Well here we go bleeding lightly for past few weeks had it checked have a large polyp. Now I had a biopsy on my womb came back normal cells, smear test normal and biopsy of polyp they didn't take away enough. Well here is the dilemma I am unable to get the polyp removed by local anaesthetic and they don't want to take it out under General anaesthetic because my b.m.I. is too high. I spoke to the lovely Kerry on here yesterday and she suggested spinal block I'm wondering if there are other alternatives.. Here I also have another problem since this afternoon I seem to be what I could only describe as a period with heavier bleeding and pain. When will this end !!!!!"
clairer1972,2019-04-27T06:37+00:00,Elleste Duet NOT in stock anywhere,"Dear All, can no longer get Elleste Duet!! anyone else had same problem?? and what have you decided to do?? Femston has been suggested as alternative i tried this previously and did not agree with me. Second time this has happened just get comfortable then back to square one!!"
pamela2016,2019-04-24T17:51+00:00,How much more is one to take,"i literally cant take no more its just too hard its always something everyday of my life it never stops. three days late and the dizziness is worse heart races when outside doing things bloated gas indigestion bowel issue,internal shakes i really don't understand why i cant get a break and why being outside makes all these symptoms worse. its not even that hot outside. so here i am in bed crying my eyes out cause its literally taking my life from me. this head dizzies has plagued me for three straight years nobody understands im looked at like its all in my head from my Dr and my family. im ready to just give up im tired of trying to push through and ignore and live life that doesn't work. i still get a period every month just comes early or late so why the symptoms so bad no relief? i pray everyday day in and day out i believe in God but im starting to think why pray its not helping."
julie34068,2019-04-28T14:23+00:00,Insomnia,"Hello lovely ladies, can i please have any advice on insomnia any tips appreciated. all i want is a good night sleep. This is one of many of my post menopause symptoms that i an struggling to deal with along with anxiety and being sleep deprived does not help ."
kim93615,2019-04-22T23:47+00:00,Join pain in the lift arm and the ringing in the ears,ladies does any of you ladies get the ringing in the ears join pain in the lift arm cant sleep at night hair getting thin. please help I been going through this since 2016.
christina81747,2019-04-29T19:35+00:00,Losing my mind,hello ladies so i have to ask am i the inly one who feels crazy before my period now i never really know when its coming but it is supposed to be herebin 6 days! i was fine then yesterday i started ti feel on edge like i wanted to cry and really angry for no reason it eventually subsided but i still wasnt myself now today ughh i am anxious hyper like my body feels in edge like im waiting for something to happen and my mind keeps rhinking it wont go away something will happen then i start to get rushes of heat so fun and i continue to worry then i just feel like bursting crying ughh i think im crazy! i know my progesterone is low and now my estrogen is starting to dip too and my cortisol is high as well ! please tell me im mot crazy!!!
hopeforever,2019-04-30T21:32+00:00,Sinus pressure and head pressure Help,For the past 3 hrs i have been dealing with the worst sinus and head pressure to the point where i cannot balance. Ladies what can i do ? Please help
pamela2016,2019-04-18T11:23+00:00,Dizzy test,im going for a dizzy test on the 30th has anyone had one of these? im not sure what all is involved they only told me on the phone not to wear eyeliner or mascara as the machine will focus on those two things and not the eyes.
grace50455,2019-03-20T10:43+00:00,Dizziness,"goodmorning LADIES, Iwoke up this morning with my head spinning !! I got up to go to the bathroom and I had to grab onto things to make it there . I felt like I was falling off the toilet. I laid back down and tried to go back to sleep but I opened my eyes and the room was spinning it is really scaring me because I have to work but I'm afraid this will affectmy driving!! has anyone has this happen?"
HopefulTrina,2019-04-30T00:09+00:00,After period issues,"Hey ladies, I was wondering do any of you have anxiety or just feel off, days after your period ends. Today is the fifth day and yesterday and today was a struggle. Anxiety, stomach issues, headache and so much more.. I'm hoping this is hormones and nothing else is going on.."
renee61138,2019-04-29T19:54+00:00,Hot Flashes???,Hello ladies. Ive been in peri for about 2 years now. I have many crazy symptoms. I'm 42 and my last period was March 6. For a bit I thought maybe i was pregnant but many test have said other wise. I have completly missed my Aprils period and from what Ive been told its common to miss a period. I should be due for a period in what i believe would be the first week in May. The last 2 days I've been hungrier than usual with some sweet and salty cravings which is my norm. I havent yest experienced hot flashes and i believe I had one today. Felt like a wave that came over me i felt dizzy and a little nauseated extremly hot and my heart rate sky rocketed. Thank god my husband was home. I splashed my face with cold water and put a cold rag on my neck. It lasted a few min. I also felt very shakey . Does this sound like a typical hot flash? Ive never had it so im unsure. And if so what do you ladies do to help it in the moment. Ughh so scary and has sent my anxiety into over drive.. Help...lol
staci88515,2019-04-30T18:08+00:00,Why am I different?,"Today, I was having a fine day, when I started to notice some anxiety creep in. I tried to ignore it, but it started to build. Then, my eyes got a bit wonky. Next, my palms began to sweat. Soon, I felt warm in my chest, back, and upper arms. Suddenly, I felt faint. My heart was beating fast and pounding. My legs became heavy. Am I passing out? Having a heart attack? I began to panic, but was in a situation where I couldn't flee. It subsided in about 10 minutes, but I am still reeling with aftereffects. Was it a hot flash? I feel like I am losing my mind. I was getting better and felt good for a few months. Now, I feel like I am headed down the roller coaster. I am so tired of being anxious and scared. I just want to cry. Why do all the other middle-aged women around me seem fine?"
